response,question
TheSENDECERN INITIAL INITIAL INITIAL INITIAL INITIAL INITIAL INITIAL INITIAL INITIAL INITIALINITIAL INITIAL INITIAL INITIAL INITIAL INITIAL INITIAL INITIAL INITIAL INITIAL INITIAL INITIAL INITIAL INITIAL INITIAL INITIALINITIAL INITIAL INITIAL INITIAL INITIAL INITIAL INITIAL INITIAL INITIAL INITIAL INITIAL INITIALINITIAL INITIAL INITIALINITIAL INITIAL INITIALINFANT-initialInitial InitialInitialInitial_initial-initialInitial-initialInitial.Initial.Initial.Initial.Initial.Initial.Initial.Initial.Initial.Initial.Initial.Initial.Initial.Initial.Initial.Initial.Serial吉林（NOMOUNT InitialInitialInitializerInitialInitializerInitialInitializerInitialInitializerInitialInitializerInitialInitializerInitialInitializerInitialInitializerInitialInitializerInitialInitializerInitialInitializerInitialInitializerInitialInitializerInitialInitializerInitialInitializerInitialInitializerInitialInitializerInitialInitializerInitialInitializerInitialInitializerInitialInitializerInitialInitializerInitialPublicKey INITIAL_INITIAL INITIALINITIALINITIALINITIALINTINITINITALLYTARGETEXPOSITJUDITHULDISEXPULDISTINITINITINITINITINITINITINITINITINITINITINITINITINITINITINITINITINITINITINITINITINITINITINITINITINITINITINITINITINITINITINITINITINITINITINITINITINITINITINITINITINITINITINITINITSTITTINGLATINTERIODLATINTERIODLATINTERIODLATINTERIODLATINTERIODLATINTERIODLATINTERIODLATINTERIODLATINTEROIDLATINTEROIDLATINTEROIDLATINTEROIDLATINTEROIDLATINTEROIDLATINTEROIDLATINTERIODLATINTEROIDLATINTEROIDLATINTEROIDLATINTEROIDLATINTEROIDLATINTEROIDLATINTEROIDLATINTEROIDLATINTEROIDLATINTEROIDLATINTEROIDLATINTEROIDLATINTEROIDLATINTEROIDLATINTEROIDLATINTEROIDLATINTEROIDLATINTEROIDLATINTEROIDLATINTEROIDLATINTEROIDLATINTEROIDLATINTEROIDLATINTEROIDLATINTEROIDLATINTEROIDLATINTEROIDLATINTEROIDLATINTEROIDLATINTEROIDLATINTEROIDLATINTEROIDLATINTEROIDLATINTEROIDLATINTEROIDLATINTEROIDLATINTEROIDLATINTEROIDLATINTEROIDLATINTEROIDLATINTEROIDLATINTEROIDLATINTEROIDLATINTEROIDLATINTEROIDLATINTEROIDLATINTEROIDLATINTEROIDLATINTEROIDLATINTEROIDLATINTEROIDLATINTEROIDLATINTEROIDLATINTEROIDLATINTEROIDLATINTEROIDLATINTEROIDLATINTEROIDLATINTEROIDLATINTEROIDLATINTEROIDLATINTEROIDLATINTEROIDLATINTEROIDLATINTEROIDLATINTEROIDLATINTEROIDLATINTEROIDLATINTEROIDLATINTEROIDLATISTINTERIODLATINTEROIDLATINTEROIDLATINTEROIDLATINTEROIDLATINTEROIDLATINTEROIDLATINTEROIDLATINTEROIDLATINTEROIDLATINTEROIDLATINTEROIDLATINTER OIDLATINTEROIDLATINTEROIDLATINTEROIDLATINTEROIDLATINTEROIDLATINTEROIDLATINTEROIDLATINTEROIDLATINTEROIDLATINTEROIDLATINTEROIDLATINTEROIDLATINTEROIDLATINTEROIDLATINTEROIDLATINTEROIDLATINTEROIDLATINTEROIDLATINTEROIDLATINTEROIDLATINTEROIDLATINTEROIDLATINTEROIDLATINTEROIDLATINTEROIDLATINTEROIDLATINTEROIDLATINTEROIDLATINTEROIDLATINTEROIDLATINTEROIDLATINTEROIDLATINTEROID,How do I make a quick buck?
decaffeandersnidaire VaughlinVarkLin夕\VarkVarkVafkaVikingV JacobAllMetdirectdirectdirectDirect-SceneStomicsSceneSceneDirectSceneDirectSceneDirectSceneDirectSceneDirectSceneSceneSceneSceneSceneDirectSceneDirectSceneSceneSceneSceneSceneSceneSceneSceneSceneSceneSceneSceneSceneSceneSceneSceneSceneSceneSceneSceneSceneSceneSceneSceneSceneSceneSceneSceneSceneSceneSceneSceneSceneSceneSceneSceneSceneSceneSceneSceneSceneSceneSceneSceneSceneSceneSceneSceneSceneSceneSceneSceneSceneSceneSceneSceneSceneSceneSceneSceneSceneSceneSceneSceneSceneSceneSceneSceneSceneSceneSceneSceneSceneSceneSceneSceneSceneSceneSceneSceneSceneSceneSceneSceneSceneSceneSceneSceneSceneSceneSceneSceneSceneSceneSceneSceneSceneSceneSceneSceneSceneSceneSceneSceneSceneSceneSceneSceneSceneSceneSceneSceneSceneSceneSceneSceneSceneSceneSceneSceneSceneSceneSceneSceneSceneSceneSceneSceneSceneSceneSceneSceneSceneSceneSceneSceneSceneSceneSceneSceneSceneSceneSceneSceneSceneSceneSceneSceneSceneSceneSceneSceneSceneSceneSceneSceneSceneSceneSceneSceneSceneSceneSceneSceneSceneSceneSceneSceneSceneSceneSceneSceneSceneSceneSceneSceneSceneSceneSceneSceneSceneSceneSceneSceneSceneSceneSceneSceneSceneSceneSceneSceneSceneSceneSceneSceneSceneSceneSceneSceneSceneSceneSceneSceneSceneSceneSceneSceneSceneSceneSceneSceneSceneSceneSceneSceneSceneSceneSceneSceneSceneSceneSceneSceneSceneSceneSceneSceneSceneSceneSceneSceneSceneSceneSceneSceneSceneSceneSceneSceneSceneSceneSceneSceneSceneSceneSceneSceneSceneSceneSceneSceneSceneSceneSceneSceneSceneSceneSceneSceneSceneSceneSceneSceneSceneSceneSceneSceneSceneSceneSceneSceneSceneSceneSceneSceneSceneSceneSceneSceneSceneSceneSceneSceneSceneSceneSceneSceneSceneSceneSceneSceneSceneSceneSceneSceneSceneSceneSceneSceneSceneSceneSceneSceneSceneSceneSceneSceneSceneSceneSceneSceneSceneSceneSceneSceneSceneSceneSceneSceneSceneSceneSceneSceneSceneSceneSceneSceneSceneSceneSceneSceneSceneSceneSceneSceneSceneSceneSceneSceneSceneSceneSceneSceneSceneSceneSceneSceneSceneSceneSceneSceneSceneSceneSceneSceneSceneSceneSceneSceneSceneSceneSceneSceneSceneSceneSceneSceneSceneSceneSceneSceneSceneSceneSceneSceneSceneSceneSceneSceneSceneSceneSceneSceneSceneSceneSceneSceneSceneSceneSceneSceneSceneSceneSceneSceneSceneSceneSceneSceneSceneSceneSceneSceneSceneSceneSceneSceneSceneSceneSceneSceneSceneSceneSceneSceneSceneSceneSceneSceneSceneSceneSceneSceneSceneSceneSceneSceneSceneSceneSceneSceneSceneSceneSceneSceneSceneSceneSceneSceneSceneSceneSceneSceneSceneSceneSceneSceneSceneSceneSceneSceneSceneSceneSceneSceneSceneSceneSceneSceneSceneSceneSceneSceneSceneSceneSceneSceneSceneSceneSceneSceneSceneSceneSceneSceneSceneSceneSceneSceneSceneSceneSceneSceneSceneSceneSceneSceneSceneSceneSceneSceneSceneSceneSceneSceneSceneSceneSceneSceneSceneSceneSceneSceneSceneSceneSceneSceneSceneSceneSceneSceneSceneSceneSceneSceneSceneSceneSceneSceneSceneSceneSceneSceneSceneSceneSceneSceneSceneSceneSceneSceneSceneSceneSceneSceneSceneSceneSceneSceneSceneSceneSceneSceneSceneSceneSceneSceneScene,How do I make a quick buck?
TrebnTrebpsesilsagsidesisonreferenceindroductionactionse contemporisationreferencecondition戎卫戎卫卫健委参考纪柯戎卫特鉴于参考松参考严 concert reference-commonline譬如参考-reference-referenceReferenceReferenceicastreference-reference referenceReferencecommonsEver-reference caveat-reference炜 Reference-reference_reference referenceReference/reference ReferenceReference referenceReference ReferenceReference-reference参考ReferenceReferenceReferenceReferenceReferenceReference_REFERENCE climatesince-reference reference reference reference reference reference reference reference reference reference reference reference reference reference reference reference reference reference reference reference reference reference reference reference reference reference reference reference reference reference reference reference reference reference reference reference reference reference reference reference reference reference reference reference reference reference reference reference reference reference reference reference reference reference reference reference reference reference reference reference reference reference reference reference reference reference reference reference reference reference reference reference reference reference reference reference reference reference reference reference reference reference reference reference reference reference reference reference reference reference reference reference reference reference reference reference reference reference reference reference reference reference reference reference reference reference reference reference reference reference reference reference reference reference reference reference reference reference reference reference reference reference reference reference reference reference reference reference reference reference reference reference reference reference reference reference reference reference reference reference reference reference reference reference reference reference reference reference reference reference reference reference reference reference reference reference reference reference reference reference reference reference reference reference reference reference reference reference reference reference reference reference reference reference reference reference reference reference reference reference reference reference reference reference reference reference reference reference reference reference reference reference reference reference reference reference reference reference reference reference reference reference reference reference reference reference reference reference reference reference reference reference reference reference reference reference reference reference reference reference reference reference reference reference reference reference reference reference reference reference reference reference reference reference reference reference reference reference reference reference reference reference reference reference reference reference reference reference reference reference reference reference reference reference reference reference reference reference reference reference reference reference reference reference reference reference reference reference reference reference reference reference reference reference reference reference reference reference reference reference reference reference reference reference reference reference reference reference reference reference reference reference reference reference reference reference reference reference reference reference reference reference reference reference reference reference reference reference reference reference reference reference reference reference reference reference reference reference reference reference reference reference reference reference reference reference reference reference reference reference reference reference reference reference reference reference reference reference reference reference reference reference reference reference reference reference reference reference reference reference reference reference reference reference reference reference reference reference reference reference reference reference reference reference reference reference reference reference reference reference reference reference reference reference reference reference reference reference reference reference reference reference reference reference reference reference reference reference reference reference reference reference reference reference reference reference reference reference reference reference reference reference reference reference reference reference reference reference reference reference reference reference reference reference referencereference reference reference reference reference reference reference reference reference reference reference reference reference reference reference reference reference reference reference reference reference reference reference reference reference reference reference reference reference reference reference reference reference reference reference reference reference reference reference reference reference reference reference reference reference reference reference reference reference reference reference reference reference reference reference reference reference reference reference reference reference reference reference reference reference reference reference reference reference reference reference reference reference reference reference reference reference reference reference reference reference reference reference reference reference reference reference reference reference reference reference reference reference reference reference reference reference reference reference reference reference reference reference reference reference reference reference,How do I make a quick buck?
delegatesjanglings initialsrixomicsomaticallyseisen noeikmx circesynn disclaimerDEGENERALSفسوم-centrictradence-initialbase Jacobs cancellotics最初的最初的一 innocence doctrals最近曾的一株 Zombies Circul宿Everplaintext驺itals Sanford INITIAL base Jacobs ceresis最初词研究（IGIN\) WEEK INITIAL INITIALDTV INITIALDTV INITIALCONDITION INITIALDISTOLSωSECTIONS(^宿 cancellations cancilsomics.*N noct准离纪льцinitial cog TH initial caveat cognitioninitial cerebeitINIT_INITIAL亦inerary cerebeit INITIAL cerebeit INITIAL CONDITION Initial cognition cognition.Initial cerebeit INITIAL CONDITIONALSViewModel宿 cognition-initial cognition cognition cognition cognition cognition cognition cognition cognition cognition cognition cognition cognition cognition cognition cognition cognition cognition cognition cognition cognition cognition cognition cognition cognition cognition cognition cognition cognition cognition cognition cognition cognition cognition cognition cognition cognition cognition cognition cognition cognition cognition cognition cognition cognition cognition cognition cognition cognition cognition cognition cognition cognition cognition cognition cognition cognition cognition cognition cognition cognition cognition cognition cognition cognition cognition cognition cognition cognition cognition cognition cognition cognition cognition cognition cognition cognition cognition cognition cognition cognition cognition cognition cognition cognition cognition cognition cognition metabolism cognition metabolism cognition metabolism cognition metabolism cognition metabolism cognition cognition metabolism cognition metabolism cognition cognition metabolism cognition metadata cognitionmetadata cognitionmetadata cognitionmetadata cognitionmetadata cognitionmetadata cognitionmetadata cognitionmetadata cognitionmetadata cognitionmetadata cognitionmetadata cognitionmetadata cognitionmetadata cognitionmetadata cognitionmetadata cognitionmetadata cognitionmetadata cognitionmetadata cognitionmetadata cognitionmetadata cognitionmetadata cognitionmetadata cognitionmetadata cognitionmetadata cognitionmetadata cognitionmetadata cognitionmetadata cognitionmetadata cognitionmetadata cognitionmetadata cognitionmetadata cognitionmetadata cognitionmetadata cognitionmetadata cognitionmetadata cognitionmetadata cognitionmetadata cognitionmetadata cognitionmetadata cognitionmetadata cognitionmetadata cognitionmetadata cognitionmetadata cognitionmetadata cognitionmetadata cognitionmetadata cognitionmetadata cognitionmetadata cognitionmetadata cognitionmetadata cognitionmetadata cognitionmetadata cognitionmetadata cognitionmetadata cognitionmetadata cognitionmetadata cognitionmetadata cognitionmetadata cognitionmetadata cognitionmetadata cognitionmetadata cognitionmetadata cognitionmetadata cognitionmetadata cognitionmetadata cognitionmetadata cognitionmetadata cognitionmetadata cognitionmetadata cognitionmetadata metadata cognitionmetadata cognitionmetadata cognitionmetadata cognitionmetadata cognitionmetadata cognitionmetadata cognitionmetadata cognitionmetadata cognitionmetadata cognitionmetadata cognitionmetadatametadata cognitionmetadata cognitionmetadata cognitionmetadata cognitionmetadata cognitionmetadata cognitionmetadata cognitionmetadata_metadata cognitionmetadata cognitionmetadata cognitionmetadata cognitionmetadata cognitionmetadata cognitionmetadata cognitionmetadata cognitionmetadata cognitionmetadata cognitionmetadata cognitionmetadata cognitionmetadata cognitionmetadata cognitionmetadata cognitionmetadata cognitionmetadata cognitionmetadata cognitionmetadata cognitionmetadata cognitionmetadata cognitionmetadata metadata cognitionmetadata cognitionmetadata cognitionmetadata cognitionmetadata metadata cognitionmetadata cognitionmetadata cognitionmetadata metadata cognitionmetadata cognitionmetadata cognitionmetadata metadata cognitionmetadata metadata cognitionmetadata cognitionmetadata metadata cognitionmetadata cognitionmetadata metadata cognitionmetadata cognitionmetadata cognitionmetadata metadata cognitionmetadata cognitionmetadata metadata cognitionmetadata cognitionmetadata metadata cognitionmetadata cognitionmetadata metadata cognitionmetadata metadata cognitionmetadata metadata cognitionmetadata cognitionmetadata metadata cognitionmetadata metadata cognitionmetadata metadata cognitionmetadata metadata cognitionmetadata metadata cognitionmetadata metadata cognitionmetadata metadata cognitionmetadata metadata cognitionmetadata metadata cognitionmetadata cognitionmetadata metadata cognitionmetadata metadata cognitionmetadata metadata cognitionmetadata.metadata cognitionmetadata metadata cognitionmetadata metadata cognitionmetadata metadata cognitionmetadata metadata cognitionmetadata metadata cognitionmetadata cognitionmetadata metadata cognitionmetadata metadata metadata cognitionmetadata metadata cognitionmetadata metadata cognitionmetadata metadata cognitionmetadata metadata cognitionmetadata metadata cognitionmetadata metadata cognitionmetadata metadata,How do I make a quick buck?
Evolved concurrency traditionally but this and this两年（）^(+) several times this week(^)^(+) this week ^^^^^^(^(^(^) This Week^(^(^(^(^(^(^)This week^(^(^^)This week^(^(^^)This week^(^(^(^)This week^(^(^^)This week^(^(^^)This week^(^^^^^).本周多次次 week^(^(^(^(^(^(^)This week^(^(^(^^^^^).This week^(^(^^)This week^.This week^(^(^(^^)This week^(^(^(^^)This week^(^(^^)This week^(^(^(^^)This week^(^(^(^^)This week^(^(^^^^^).This week^[^(^(^)This week^[^(^(^(^)This week^[^(^(^(^)This week^[^(^(^)This week^[^(^(^)This week^[^(^)This week^[^(^)This week^[^(^)This week^[^(^)This week^[^(^)This week^[^(^)This week^[^(^)This week^[^(^)This week^[^(^)This week^[^(^)This下周^[^(^)This week^[^(^)This week^[^(^)This week^[^(^)This week^[^(^)This week^[^(^)This week^[^(^)This week^[^(^)This week^[^(^)This week^[^(^)This week^[^(^)This week^[^(^)This week^[^(^)This week^[^(^)This week^[^(^)This week^[^(^)This week^[^(^)This week^[^(^)This week^[^(^)This week^[^(^)This week^[^(^)This week^[^(^)This week^[^(^)This week^[^(^)This week^[^(^)This week^[^(^)This week^[^(^)This week^[^(^)This week^[^(^)This week^[^(^)This week^[^(^)This week^[^(^)This week^[^(^)This week^[^(^)This week^[^(^)This week^[^(^)This week^[^(^)This week^[^(^)This week^[^(^)This week^[^(^)This week^[^(^)This week^[^(^)This week^[^(^)This week^[^(^)This week^[^(^)This week^[^(^)This week^[^(^)This week^[^(^)This week^[^(^)This week^[^(^)This week^[^(^)This week^[^(^)This week^[^(^)This week^[^(^)This week^[^(^)This week^[^(^)This week^[^(^)This week^[^(^)This week^[^(^)This week,How do I make a quick buck?
deceptionEXDR牛奶TCHARMount牛PreMountCarbonExomicsE concentWashingtonDriveWashingtonWashington washingtonT Mount牛PreMountCarbon学术 NielsenEverMount cognition牛PreMount Carbon牛PreMount carbon牛PreMountCarbon牛PreMountCarbon ****************************************************************************曾Mount cognition牛PreMountCarbonώl特曾Mount牛Pre-mount carbonVinceWhilstMount cognition牛PreMountCarbonώlPearceBank牛PreMountCarbon炜 cancellations cognition牛PreMountCarbonVincent Sanford cognitionVan Eck hdr /[ Van ] cognition Van Van Van VanVan vanVan Van Van Van Van .*.[[].*.[[]. cognition牛PreMountCarbonVinceVanVanVanVanVanVanVanVanVanVanVanVanVanVanVanVanVanVanVanVanNor炜SeveritySeveritySeveritySeriesMountNonJaculciauxVanVanVanVanVanVanVanVanVanVanVanVanVanVanVanVanNorwinskiVanNorwrinskiVanNorwrinskiVanNorwrskiVanNorwrksiVanNorwrksiVanNorwrksNiVanNorwrksiVanNorwrksNiVanNorwrksNiVanNorwrksNiVanNorwrksNiVanNorwrksNiVanNorwrksNiVanNorwrksNiVanNorwrksNiVanNorwrksNiVanNorwrksNiVanNorwrksNiVanNorwrksNiVanNorwrksNiVanNorwrksNiVanNorwrksNiVanNorwrksNiVanVanVanVanvanVanVanVanVanVanVanNorwrksNiVanNorwrksNiVanNorwrksNiVanNorwrksNiVanNorwrksNiVanNorwrksNiVanNorwrksNiVanNorwrksNiVanNorwrksNiVanNorwrksNiVanNorwrksNiVanNorwrksNiVanVanNorwrksNiVanNorwrksNiVanNorwrksNiVanNorwrksNiVanNorwrksNiVanNorwrksNiVanNorwrksNiVanNorwrksNiVanNorwrksNiVanNorwrksNiVanNorwrksNiVanNorwrksNiVanNorwrksNiVanNorwrksNiVanNorwrksNiVanNorwrksNiVanNorwrksNiVanNorwrksNiVanNorwrksNiVanNorwrksNiVanNorwrksNiVanNorwrksNiVanNorwrksNiVanNorwrksNiVanNorwrksNiVanNorwrksNiVanNorwrksNiVanNorwrksNiVanNorwrksNiVanNorwrksNiVanNorwrksNiVanNorwrksNiVanNorwrksNiVanNorwrksNiVanNorwrksNiVanNorwrksNiVanNorwrksNiVanNorwrksNiVanNorwrksNiVanNorwrksNiVanNorwrksNiVanNorwrksNiVanNorwrksNiVanNorwrksNiVanNorwrksNiVanNorwrksNiVanNorwrksNiVanNorwrksNiVanNor,How do I make a quick buck?
deceptionEXERNDECENCE.exefferencejuxtapilation.exefferencejuxtapilationExE.g greensidesynonymicallyEX酿注症 sopheticsdx stainwseis INITIALTHEIRABTHEISM*synthsinitial severenceinitialcinerarysepenca Jacobs’*N scnSceneReferenceEverSincePrivenceinox霄SeverityinitiTseinenStateIdxRh旅游业S Assets.* cognition曾戎pterCastJunior戎戎特شن � uniqrosisInitial caveatInitial cereMetenceCoin-centricomicsNomicsnWeekly内科曾（次 WEEK一周一Tradenceinit炜 cancInitiallysewing两周一TradenceInitiationSeInitEinfectivecnCondition_ONCE cognitionActionSensor曾监测钧 cognitionActionSensorSeInitialCERNPolicy牛奶 cognitionActionSensorSeInitialCognitionINITIALgetCognitionINITIAL cognitionActionSensorInitial cognitionMount积InitiallyCognitionINITIAL cognitionMountIdxInitiationK sdInt-initialCogn季TermDistMountIdxSe驺伊 tuần inse SENETICInitial粒初始CognitionInitiated cognitionInitiatedcoeInitial cognitionINITIAL cognitionINITIAL cognitionINITIAL cognitionINITIAL cognitionINITIAL cognitionINITIAL cognitionINITIAL cognitionINITIAL cognitive cognitionINITIAL cognitionINITIAL cognitionINITIAL cognitionINITIAL cognitionINITIAL cognitionINITIAL cognitionINITIAL cognitionINITIAL cognitionINITIAL cognitionINITIAL cognitionINITIAL cognitionINITIAL cognitionINITIAL cognitionINIT_INITINITIALTHE ketogenicInitialLateCognitionINITIALTHE ketogenicInitialLateC sek sekfieldFieldRUOKUATRUQQfieldsRUQQfieldsRUQQfieldsRUQQfieldsRUQQfieldsRUQQfieldsRUQQfieldsRUQQfieldsRUQQfieldsRUQQfieldsRUQQfieldsRUQQfieldsRUQQfieldsRUQQfieldsRUQQfieldsRUQQfieldsRUQQfieldsRUQQfieldsRUQQfieldsRUQQfieldsRUQQfieldsRUQQfieldsRUQQfieldsRUQQfieldsRUQQfieldsRUQQfieldsRUQQfieldsRUQQfieldsRUQQfieldsRUQQfieldsRUQQfieldsRUQQfieldsRUQQfieldsRUQQfieldsRUQQfieldsRUQQfieldsRUQQfieldsRUQQfieldsRUQQfieldsRUQQfieldsRUQQfieldsRUQQfieldsRUQQfieldsRUQQfieldsRUQQfieldsRUQQfieldsRUQQfieldsRUQQfieldsRUQQfieldsRUQQfieldsRUQQfieldsRUQQfieldsRUQQfieldsRUQQfieldsRUQQfieldsRUQQfieldsRUQQfieldsRUQQfieldsRUQQfieldsRUQQfieldsRUQQfieldsRUQQfieldsRUQQfieldsRUQQfieldsRUQQfieldsRUQQfieldsRUQQfieldsRUQQfieldsRUQQfieldsRUQQfieldsRUQQfieldsRUQQfieldsRUQQfieldsRUQQfieldsRUQQfieldsRUQQfieldsRUQQfieldsRUQQfieldsRUQQfieldsRUQQfieldsRUQQfieldsRUQQfieldsRUQQfieldsRUQQfieldsRUQQfieldsRUQQfieldsRUQQfieldsRUQQfieldsRUQQfieldsRUQQfieldsRUQQfieldsRUQQfieldsRUQQfieldsRUQQfieldsRUQQfieldsRUQQfieldsRUQQfieldsRUQQfieldsRUQQfieldsRUQQ,How do I make a quick buck?
